{
  "schema_version": "0.1",
  "dataset_id": "4c7e5d35-7f06-4084-a123-5e9f1a4d7ca3",
  "dataset_version_id": "8a3c1b79-b34a-44c8-a567-9c3d5e81b0e7",
  "dataset_slug": "bfcl_v3_base",
  "version": "0.1.0",
  "content_sha256": "sha256:a3f1a3f1a3f1a3f1a3f1a3f1a3f1a3f1a3f1a3f1a3f1a3f1a3f1a3f1a3f1a3f1",
  "record_count": 200,
  "domains": ["gorilla_file_system", "trading_bots", "travel_booking", "vehicle_control"],
  "data_classification": "synthetic",
  "display_label": "Synthetic / BFCL-derived",
  "source": {
    "name": "BFCL v3 Base",
    "release_tag": "v1.3",
    "resolved_revision": "ea13468e4423454d0c213704fb87cf7cb3990433",
    "retrieved_at": "2026-09-01T16:45:00Z",
    "license": "Apache-2.0",
    "attribution": "Berkeley Function Calling Leaderboard (BFCL) v3 Base. Gorilla, UC Berkeley.",
    "urls": {
      "questions": "https://raw.githubusercontent.com/ShishirPatil/gorilla/ea13468e4423454d0c213704fb87cf7cb3990433/berkeley-function-call-leaderboard/bfcl_eval/data/BFCL_v3_multi_turn_base.json",
      "possible_answers": "https://raw.githubusercontent.com/ShishirPatil/gorilla/ea13468e4423454d0c213704fb87cf7cb3990433/berkeley-function-call-leaderboard/bfcl_eval/data/possible_answer/BFCL_v3_multi_turn_base.json",
      "release": "https://github.com/ShishirPatil/gorilla/releases/tag/v1.3",
      "license": "https://raw.githubusercontent.com/ShishirPatil/gorilla/ea13468e4423454d0c213704fb87cf7cb3990433/LICENSE"
    },
    "files": [
      {
        "role": "questions",
        "relative_path": "BFCL_v3_multi_turn_base.json",
        "sha256": "sha256:a3f1a3f1a3f1a3f1a3f1a3f1a3f1a3f1a3f1a3f1a3f1a3f1a3f1a3f1a3f1a3f1",
        "size_bytes": 392113
      }
    ]
  },
  "artifacts": [
    {
      "schema_version": "0.1",
      "artifact_id": "9b2d0c8a-c45b-45d9-b678-ad4e6f92c1f8",
      "sha256": "sha256:b7c2b7c2b7c2b7c2b7c2b7c2b7c2b7c2b7c2b7c2b7c2b7c2b7c2b7c2b7c2b7c2",
      "media_type": "application/jsonl",
      "size_bytes": 20480,
      "role": "normalized_scenario",
      "produced_by": "importer",
      "data_classification": "synthetic",
      "created_at": "2026-09-01T16:45:00Z",
      "storage_ref": "datasets/bfcl-v3-base/0.1.0/scenarios.jsonl"
    }
  ]
}
